{
  "$schema": "https://json-schema.org/draft/2020-12/schema",
  "$id": "https://github.com/bertus37987/ai-tools-directory/schemas/category.schema.json",
  "title": "AI Tool Category",
  "description": "Schema for AI tool categories",
  "type": "object",
  "required": ["id", "name", "slug", "description", "sort_order"],
  "properties": {
    "id": {
      "type": "string",
      "pattern": "^[a-z0-9-]+$",
      "description": "Unique category identifier"
    },
    "name": {
      "type": "string",
      "minLength": 2,
      "maxLength": 50,
      "description": "Display name"
    },
    "slug": {
      "type": "string",
      "pattern": "^[a-z0-9-]+$",
      "description": "URL-friendly slug"
    },
    "description": {
      "type": "string",
      "maxLength": 200,
      "description": "Category description"
    },
    "icon": {
      "type": "string",
      "description": "Icon identifier"
    },
    "color": {
      "type": "string",
      "pattern": "^#[0-9A-Fa-f]{6}$",
      "description": "Hex color code"
    },
    "sort_order": {
      "type": "integer",
      "minimum": 0,
      "description": "Display order"
    },
    "created_at": {
      "type": "string",
      "format": "date-time"
    },
    "updated_at": {
      "type": "string",
      "format": "date-time"
    }
  }
}